review_id,text,entities
,"this is probably my favorite ramen place in town! we got two char siu pork buns and mega paitan ramen best seller! . the pork bun was amazing. i would say it is one of my favorite dishes. highly recommended. the ramen was also really good, huge portion with rich soup!!!!!! great service too.","[(29, 34, 'FOOD'), (61, 79, 'FOOD'), (84, 101, 'FOOD'), (96, 101, 'FOOD'), (212, 217, 'FOOD'), (258, 267, 'FOOD')]"
,"ordered chowder sampler, but as they put bacon in new england clam chowder had to limit only to seafood - base chowder seafood brisque and manhattan chowder . seafood brisque was creamy and yummy. but tomato-heavy manhattan chowder was off the mark, and had chewy clams . also ordered fried oyster poboy. the quantity of poboy for inches and quality was not good. i think this chowder place is good only for their namesake dish chowder . you get better and bigger sandwiches elsewhere.","[(8, 15, 'FOOD'), (41, 46, 'FOOD'), (50, 74, 'FOOD'), (67, 74, 'FOOD'), (111, 118, 'FOOD'), (119, 134, 'FOOD'), (139, 156, 'FOOD'), (149, 156, 'FOOD'), (159, 174, 'FOOD'), (214, 231, 'FOOD'), (224, 231, 'FOOD'), (285, 302, 'FOOD'), (377, 384, 'FOOD'), (428, 435, 'FOOD')]"
2118,"went here on a date because my date saw it on john wick. when we got here we read up on the history of the restaurant & how it was the first fine dining establishment in america.we both extremely enjoyed the atmosphere & definitely had the best fine dining experience thanks to the helpful staff.my date ordered the signature delmonico's steak and i ordered the lamb chops. we had a started of west coast oysters then for our side orders we had mash potatoes and asparagus. i can for the first time say when i tasted the lamb chops and steak, i cried. i cried tears of joy because it was absolutely the most delicious meat to ever hit my tastebuds. however, the most surprising thing was the simple mashed potatoes and asparagus being absolutely perfected. lastly, the west coast oysters came with three different sauces to try them with and i can happily say i enjoyed every slurp.i would absolutely recommend taking anyone here to have the best full experience of fine dining.","[(338, 343, 'FOOD'), (362, 372, 'FOOD'), (394, 412, 'FOOD'), (445, 458, 'FOOD'), (463, 472, 'FOOD'), (521, 531, 'FOOD'), (536, 541, 'FOOD'), (699, 714, 'FOOD'), (719, 728, 'FOOD'), (769, 787, 'FOOD')]"
,", + reviews & . stars for fried chicken put this place on the map for my boyfriend and me. upon arriving we saw a large crowd of people waiting outside so my boyfriend dropped me off in front while he went to look for parking. your whole party needs to be here in order to be seated . the whiteboard to write your name is to your right as soon as you enter. put your name down and wait. the place is relatively small, so not much space but i did notice a small separate dining room for a larger party. it was not that long before we were seated maybe minutes i'm pretty patient so wait times do not bother me too much. we ordered orders of the original dry fried chicken not sure why it is called dry because they are the exact opposite. chicken is moist and covered in sauce. the sauce is sweet, tangy, and salty. it has some red pepper flakes in it. reminded me of panda express's orange chicken but better. plus they use drummettes & wings . this is what they are known for and my boyfriend and i were fans! soo good. szechuan roasted duck & buns one of my fave chinese wedding dishes which i had to introduce to my mexican boyfriend. he fell in love! he cleaned the bones and basically ate whole thing by himself. i personally think i've had better but i'm just glad he liked it. the dry black bean noodles were alright. definitely nothing out of this world. the texture of the mushy noodles kind of grossed me out. overall i give this place . stars rounding to . the chicken alone made up for the lack of customer service. the servers were disgruntled and some of the plates and tea cups were dirty. overall i had a great time and we took home leftovers.","[(26, 39, 'FOOD'), (653, 670, 'FOOD'), (738, 745, 'FOOD'), (883, 897, 'FOOD'), (1021, 1042, 'FOOD'), (1045, 1049, 'FOOD'), (1288, 1310, 'FOOD'), (1388, 1395, 'FOOD'), (1472, 1479, 'FOOD')]"
1398,not a fan. i have had better ribs down the street at la villa. no offense but for however long we waited it most definitely was not worth the wait or price for the ribs. meh,"[(29, 33, 'FOOD'), (164, 168, 'FOOD')]"
,oldest steakhouses in new york. great quality of steak. very flavorful. the steak was days old steak,"[(49, 54, 'FOOD'), (76, 81, 'FOOD'), (95, 100, 'FOOD')]"
2696,would never return. we are all sitting here still dumbfounded that this place is serving this quality of food. the soup tasted like a minestrone makeover mess. the quesadillas were weak. the enchiladas were so weak. the beans were awful. the guac was and so so bland. and they messed up my blended margarita. it tasted like a chemical problem.four us came in mega hungry and excited and left still hungry because we could not finish the trash that was in front of us.not worth the cost and not worth the doors being open to this place.again. never coming back. guys. beware!,"[(115, 119, 'FOOD'), (164, 175, 'FOOD'), (191, 201, 'FOOD'), (220, 225, 'FOOD'), (242, 246, 'FOOD'), (290, 307, 'FOOD')]"
,"i've been here times this summer and the food has been good every time. i've had the guacamole & chips, both types of sliders and the chicken chimichangas. the guacamole comes out fresh and delicious and the chips are nice and crispy. the sliders are little sliders that i have as a meal every time and they are perfect. the chimichangas were crisp on the outside and stuffed perfectly on the inside and topped with sour cream, guacamole and cheese. the service is always good, attentive host and waitresses and i've never had to wait for a table even when the place is packed during weekday lunch hour around pm . i have not had a problem walking the few blocks there and back on my lunch break and being back at work within an hour. the restaurant is nice inside and there is plenty of seating downstairs and upstairs and the prices are great for the area.","[(85, 94, 'FOOD'), (97, 102, 'FOOD'), (118, 125, 'FOOD'), (134, 154, 'FOOD'), (160, 169, 'FOOD'), (208, 213, 'FOOD'), (239, 246, 'FOOD'), (258, 265, 'FOOD'), (325, 337, 'FOOD'), (428, 437, 'FOOD')]"
762,"i had been looking forward to this place for sometime. unfortunately it did not live up to its hype. i ordered classic eggs benedict with a side of pancakes, juice and coffee. first let me preface that i always order eggs benedict where ever i am. because i had to make it so many times when cooking i know what it is supposed to look and taste. this one did neither. if i wanted a half of a shank of ham i would have ordered one. eggs benedict is supposed to have shaved ham or canadian bacon. the hollandaise was also lacking in that it was cold and had no taste at all. the pancakes although tasted good were soggy and cold. again very disappointing. they really need a quality person running their line and controlling what comes out of the kitchen. doubt i will ever return but luckily chicago has a lot of other choices","[(111, 132, 'FOOD'), (148, 156, 'FOOD'), (158, 163, 'FOOD'), (168, 174, 'FOOD'), (217, 230, 'FOOD'), (401, 404, 'FOOD'), (431, 444, 'FOOD'), (465, 475, 'FOOD'), (472, 475, 'FOOD'), (479, 493, 'FOOD'), (499, 510, 'FOOD'), (577, 585, 'FOOD')]"
2893,"ramen was ok, but their horrible service made me speechless.first, i ordered the extra spicy miso paitan and thought it might be too spicy for me. so i asked for a small plate politely and took some spices and a little portion of the scallions out onto the plate. this waitress stood next to me and meanly angrily accused me that if i did not want scallions, i should have told them earlier. she even said it twice loudly. so rude. i was embarrassed but shook because i like to eat scallions but they put too much in my bowl covering the noodles and broth so i wanted to take some out. plus i just did not want my ramen to be too spicy so i had to took some spices out too is that something unreasonable to do that you had to act like that it is entirely my freedom to do whatever i want with my ramen, no anyway, i did not say anything to her and kept on eating.meanwhile, since my bf and i were seated under the ac, i was facing the wind and cold air for the whole time. it got way too cold, and my chest felt really uncomfortable so i asked another waitress to adjust the ac she did it happily friendlily and i appreciate that!the ramen i ordered was mediocre did not like the flavor so you know, i was not really satisfied with my overall experience.when it comes to the check, i did not want to give % bc of the first waitress's attitude and put % down. she, the same lady^, counted the cash in front of us and threw it back, be like tips are not included & you gave too little in a horrific attitude. me and my bf were shook honestly, if your service was good enough i would have gave you % or more. and i have the rights to give how much i want depending on the service not mandatory or at a fixed rate. now she has the decency to demand for more tips very unprofessional. she got so angry after i explained why i would not give more, took the money and stormed out.this lady makes me not want to go back to totto ramen ever again in my entire life. and i will not lol.","[(0, 5, 'FOOD'), (81, 104, 'FOOD'), (234, 243, 'FOOD'), (348, 357, 'FOOD'), (482, 491, 'FOOD'), (614, 619, 'FOOD'), (796, 801, 'FOOD'), (1134, 1139, 'FOOD'), (1921, 1926, 'FOOD')]"
2085,"upon the suggestion of the concierge in our hotel, we enjoyed a wonderful evening of celebration at this restaurant. we could not have chosen a better place. the atmosphere is urban and trendy without being pretentious hard to pull off, the food is inovative yet understandable, and the staff is one of the most friendly in the city. everything on the menu looked yummy, but we started with the dungeness crab over fried green tomatoes and the seafood 'nola' salad with dungeness crab and gulf shrimp. both of these were great choices, piled high with the fresh crab. for dinner the highlight was the grilled fall king salmon with chanterelle and wild mushroom jus, a simple yet flavorful preparation of the salmon. for dessert we chose a couple of old-school ones that have been updated perfectly toulouse bananas foster and white chocolate bread pudding. the restaurant is not large, so reservations are suggested. we loved the decor, especially the iron lighting scultpures that we were told was done by a former bartender. the gm stopped by the table and shared a laugh and a wine suggestion, and it was resonable and really good. the bonus, though, is that this restaurant uses local, sustainable ingredients. by the way, the floor to ceiling windows have a perfect view of the space needle.","[(395, 409, 'FOOD'), (415, 435, 'FOOD'), (444, 464, 'FOOD'), (470, 484, 'FOOD'), (489, 500, 'FOOD'), (494, 500, 'FOOD'), (562, 566, 'FOOD'), (601, 642, 'FOOD'), (647, 664, 'FOOD'), (807, 821, 'FOOD'), (826, 855, 'FOOD'), (1080, 1084, 'FOOD')]"
1702,"i dressed up pretty nicely for this place. just a floral dress and flats while my boyfriend did semi-formal with a button up and a sports coat. we were both a bit nervous about overdressing or not dressing up enough but when we got there, there was a variety of dress among the people. we were probably somewhere in the middle as there were a few guys in jeans, and some girls who wore maxi skirts or trousers. honestly, it would just depend on how comfortable you are with dressing up as the restaurant itself did not seem to mind or at least they did not say anything about those in jeans or way more under-dressed than the majority. we got to sit in a super comfy booth and the waiter was so awesome. he made a lot of jokes and was helpful when answering our questions and offering suggestions. for our meal, we ordered a calamari , candied bacon, an oz filet migon, and a oz of the ribeye. the calamari was excellent. it was not overly chewy or too salty. the candied bacon was honestly to die for. there are a lot of places i've had them at that were too much like jerky and much too tough. this one had the consistency of thick-cut bacon that was crispy on the outside yet chewy on the inside. it was sweet but not rot-your-teeth sweet. just what i was expecting. now for the main course. the steak was wonderful. i eat a lot of steak and honestly this was perfection. it was cooked with just the right amount of pink i asked for, and was sooooo juicy. it was really well seasoned and honestly, the baby carrots that came with it were superb as well. my boyfriend's steak was huuuuge and he probably was only able to finish it all because of how good it was. overall, i'm so glad we dressed up and were able to experience this place in all of it is glory. i will definitely come back one of these days.","[(825, 833, 'FOOD'), (836, 849, 'FOOD'), (857, 868, 'FOOD'), (886, 892, 'FOOD'), (898, 906, 'FOOD'), (964, 977, 'FOOD'), (1070, 1075, 'FOOD'), (1138, 1143, 'FOOD'), (1299, 1304, 'FOOD'), (1335, 1340, 'FOOD'), (1505, 1517, 'FOOD'), (1510, 1517, 'FOOD'), (1572, 1577, 'FOOD')]"
291,"yummy yummy fried chicken magic. . do not miss out on the fried chicken. . the potstickers are also super bomb. . absolutely do not miss out on the fried chicken wet or dry but the sauce they put on it is really magic. so this place gets ridiculously crowded for dinner time i've driven past the crowds on the way home but at lunch actually it was not too bad. there was about a min wait while they cleared out a table for our party of two. the place is fairly spacious with lots of room for big parties but they also have some four tops for those that are traveling lighter. we ordered the fried chicken, potstickers on the recommendation of a coworker and fellow yelpers , honey walnut shrimp , and the shrimp and leek dumplings . all really tasty. the honey walnut shrimp is probably pretty standard and i've had better dumplings at other places but these were still pretty good. i would recommend the fried chicken did i say that enough yet and the potstickers if you are at a loss. they have lunch specials and the lunch special fried chicken was pcs as opposed to . they are served wet or dry and i thought we ordered ours dry but they came with a sauce on it. which i would think would be the wet ones either way they were still super good. parking sucks here. it is irving and no matter when you go, it will be pretty tough. meters and some free street parking on the side streets if you are extra lucky.","[(12, 25, 'FOOD'), (58, 71, 'FOOD'), (79, 90, 'FOOD'), (148, 161, 'FOOD'), (591, 604, 'FOOD'), (606, 617, 'FOOD'), (675, 694, 'FOOD'), (705, 730, 'FOOD'), (755, 774, 'FOOD'), (823, 832, 'FOOD'), (905, 918, 'FOOD'), (953, 964, 'FOOD'), (1034, 1047, 'FOOD')]"
1667,i had a filet mignon . it was cooked well. very tasty. the service was good and everyone was super polite and professional. i recommend this place. it is can be pricey.,"[(8, 20, 'FOOD')]"
,"great dinner we started with lobster bisque, which was awesome. split a green fields salad. linda did alaskan king crab which she loved. i went with skirt steak and a lobster tail. talk about gluttony our server, roger, was awesome definitely recommend","[(29, 43, 'FOOD'), (72, 90, 'FOOD'), (102, 119, 'FOOD'), (149, 160, 'FOOD'), (167, 179, 'FOOD')]"
295,"i do not really like chinese food, which makes this harder. it is a real struggle between three and four. all around they are very much as one would expect a chinese restaurant to be nothing special, but solid american style chinese food except those chicken wings are above par. their dry fried chicken wings are quite good. very nicely fried, and the sauces is pretty tasty although i could have gone spicier maybe if i were not white they would have made them spicier who knows. the other things eh. tasted like chinese food. we got the green beans another chinese dish i can sometimes handle and they were ok but i've definitely had better. we also got fried rice which was fine but did not stand out in anyway. last we got shrimp and leek dumplings , which i did not try, but my husband stays they were standard. they do get busy but they also seat people at their large family tables that do not know each other so that helps.","[(251, 264, 'FOOD'), (296, 309, 'FOOD'), (540, 551, 'FOOD'), (657, 667, 'FOOD'), (728, 753, 'FOOD')]"
298,"excellent food! everything we ordered was great, i want to order each item on the menu. of course, the original fried chicken was crispy with the best sweet and tangy sauce. the shrimp and leek dumpling were very fresh tasting. the pork chow mein was also worth noting. very large portions at a reasonable price!","[(103, 125, 'FOOD'), (151, 172, 'FOOD'), (178, 202, 'FOOD'), (232, 246, 'FOOD')]"
1039,"a must!! i liked it more than girl and the goat and we just showed up a little after opening and were seated immediately. no wait. we had the octopus, beet salad, pork shoulder, butternut squash soup, and pigs ear . all great pics! we looked over and the table next to us had almost exactly the same thing. guess all the reviews are true and you should get them because they are the most popular for a reason! my favorites were the octopus and pork shoulder. the mashed potatoes and gravy beneath the pork shoulder were heavenly. the octopus is the best i have ever had!! i am drooling thinking about it. the pigs ear dish was also delicious! i was scraping the plate clean. i would not let them clear the table until the plate was spotless, it was so good.","[(142, 149, 'FOOD'), (151, 161, 'FOOD'), (163, 176, 'FOOD'), (178, 199, 'FOOD'), (205, 213, 'FOOD'), (432, 439, 'FOOD'), (444, 457, 'FOOD'), (463, 478, 'FOOD'), (483, 488, 'FOOD'), (501, 514, 'FOOD'), (534, 541, 'FOOD'), (609, 617, 'FOOD')]"
,"the food was great, as we had been told by friends although great, my husband said he liked the steak better from places such as john howie and daniel's. wine selection was amazing, as they had a large amount of half bottles perfect as only my husband drinks wine. they also had three cider selections, which i was pleased with. the calamari was amazing, probably the best i've ever had high quality, perfect type & amount of breading, and a nice sauce. the french onion soup was good. steak was great. asparagus with bernaise was good. mashed potatoes were great. ceasar salad was great. creme brulee was amazing. however, the ambiance was not what we have come to expect from high end steakhouses like this.the entire place is open ie. not private, and the decor is dated. even the menu material seemed cheap laminated. however, they are closing soon for months for a remodel, so hopefully that will be fixed. the service was great, but not amazing, like we would expect for a dinner. for example, after our dessert was cleared we waited about minutes for the check, our server nowhere to be seen. for the price, we are more likely to go to john howie or daniel's we were not a fan of el gaucho, and are kinda over ruth's chris.","[(96, 101, 'FOOD'), (154, 158, 'FOOD'), (259, 263, 'FOOD'), (285, 290, 'FOOD'), (333, 341, 'FOOD'), (447, 452, 'FOOD'), (458, 475, 'FOOD'), (486, 491, 'FOOD'), (503, 526, 'FOOD'), (537, 552, 'FOOD'), (565, 577, 'FOOD'), (589, 601, 'FOOD')]"
712,"hey this place is definitely worth a visit! plenty of seating and the menu has everything for breakfast and brunch lovers! most eggor omelette dishes are served with a choice of toast or pancakes. a great selection of pancakes with endless topping choices. and who can resist a place that serves soft whipped butter, not those frozen little packages of butter so common in most restaurants! kudos to this place for hiring great servers and keeping the place clean and appealing. see you next time i am in chicago!","[(128, 131, 'FOOD'), (134, 142, 'FOOD'), (178, 183, 'FOOD'), (187, 195, 'FOOD'), (218, 226, 'FOOD'), (296, 315, 'FOOD'), (353, 359, 'FOOD')]"
,"my boyfriend and i were doing some pike place food hopping and stopped in here based on the amazing reviews. the line was enormous but moved pretty quickly - we were wrapped around all the way to rachel's ginger beer and still only waited maybe min. we shared a four chowder sampler. we got the new england clam chowder , the seafood bisque, the scallop chowder , and the special lobster and corn chowder . the sampler came with bread on the side. we both really liked all of the chowders , we went into it thinking the lobster would be our favorite, but it was probably our least favorite. we realized the other chowders on our tray tasted more like a traditional new england clam chowder than their actual clam chowder did. my favorite was the scallop chowder and my boyfriend's the seafood bisque. if we came back, we would probably just get bowls of those soups.","[(295, 319, 'FOOD'), (326, 340, 'FOOD'), (346, 361, 'FOOD'), (372, 404, 'FOOD'), (429, 434, 'FOOD'), (520, 527, 'FOOD'), (665, 689, 'FOOD'), (708, 720, 'FOOD'), (746, 761, 'FOOD'), (785, 799, 'FOOD')]"
1340,"we tried this restaurant for the first time and while the st louis ribs were meaty and delicious, the baby backs were dry and unappealing. we also had the chopped brisket and mac n cheesedry with little favor. the brisket chili was very tasty. not our favorite triple d place at all.","[(58, 71, 'FOOD'), (102, 112, 'FOOD'), (155, 170, 'FOOD'), (175, 187, 'FOOD'), (214, 227, 'FOOD')]"
,"i find alinea a tough restaurant to review. my experience there was a mixture of revelation and disappointment, but i am giving it a reluctant five stars because overall it was a very memorable experience. alinea is a bucket list restaurant. a trip down alice's rabbit hole. it is expensive very expensive and difficult to get a reservation. upon being seated we were served an amuse bouche, in the form of a little clay pot filled with frozen snow of some kind, fish roe, and some edible flowers and herbs. was it delicious? not really, but it was interesting. i will not go over every course in detail. some were very delicious, some were slightly disappointing. there were some theatrical surprises that were definitely brilliant, like when liquid nitrogen is poured over the centrepiece of oranges and you are completely engulfed in a fog of citrusy smoke while eating some orangeshaped bites on a glowing plate, filled with an intense cloveflavoured liqueur. it is an almost overwhelmingly intense sensory experience that is beyond simple categories like delicious. i am not sure if it was delicious. it was intense, nostalgic and... what is the right word? beautiful. some of the dishes presented flavours i had never experienced before. i could almost feel my brain creating new neural pathways as it tried to grapple with them. i even had vivid flavour flashbacks the next day something i have never experienced before the memory of redolent juniper smoke, the rich umami of bouillabaisse with it is reconstituted langoustine noodle. if i could do it all over again i would have skipped the wine pairings and gone for more courses. the wine was good, but was actually overkill for the small courses a full glass with every course. i sometimes felt rushed to finish the wine before the next course arrived and felt a bit tipsy by the end of the meal. then of course there is the edible helium balloon . it is hard to give a meal that ends with an edible balloon less than five stars, even though there were some bumps and disappointments along the way.","[(378, 390, 'FOOD'), (463, 471, 'FOOD'), (482, 506, 'FOOD'), (794, 801, 'FOOD'), (940, 962, 'FOOD'), (1483, 1496, 'FOOD'), (1522, 1540, 'FOOD'), (1900, 1907, 'FOOD'), (1961, 1968, 'FOOD')]"
