review_id,text,entities
,"i really want to give this place a stars, but my experience was not the best. went to chicago for a long weekend trip, and decided to come here to celebrate end of exams. we reserved weeks before and paid in advance online. we were presented with a course meal, some of my favourites included the lobster, black truffle , duck, and milk chocolate. the lobster dish included curry, earl grey, and grapefruit. the duck dish was presented ways including foie gras. the black truffle was presented like a dumpling, and as you bite into it the richness of the truffle and parmesan cheese ooozes out. the milk chocolate finale was a piece of artwork made in front of us, consisting of a centerpiece of chocolate, with splashes of violet puree, hazelnut, and cream on the side. i was not a big fan of the lily bulb, and rhubarb. the lily bulb was way to sour for my taste, i believe it was included as a palette cleanser but nevertheless, i did not enjoy it. the rhubarb consisted of celery root, celery branch, and licorice, and was a miss. overall, the presentation, creativity, and attention to detail in all of the dishes are spectacular. definitely a on that end. however, the taste of the plates were a hit or miss. in my opinion, there is definitely a greater emphasis on the presentation of the food versus the actual taste. the waiterswaitresses that we encountered seemed a bit pretentious. i felt like we were constantly being pushed to finish our dishes so they can serve the next dish, and this definitely detracted from the overall dining experience. only thing i liked was when we left the restaurant, the doorman called us a cab. i would give the overall service a .. overall verdict superb presentation of the dishes, subpar service. would not recommend. i am sure there are comparable restaurants in the chicago dining scene with better service.","[(297, 304, 'FOOD'), (306, 319, 'FOOD'), (322, 326, 'FOOD'), (332, 346, 'FOOD'), (352, 359, 'FOOD'), (374, 379, 'FOOD'), (381, 390, 'FOOD'), (396, 406, 'FOOD'), (412, 416, 'FOOD'), (451, 460, 'FOOD'), (466, 479, 'FOOD'), (501, 509, 'FOOD'), (555, 562, 'FOOD'), (567, 582, 'FOOD'), (599, 613, 'FOOD'), (696, 705, 'FOOD'), (724, 736, 'FOOD'), (738, 746, 'FOOD'), (752, 757, 'FOOD'), (798, 807, 'FOOD'), (813, 820, 'FOOD'), (826, 835, 'FOOD'), (956, 963, 'FOOD'), (977, 988, 'FOOD'), (990, 1003, 'FOOD'), (1009, 1017, 'FOOD')]"
,the homemade corned beef hash was unappetizing and gave me a really bad case of food poisoning. hours later and i am still trying to recover from it. my boyfriend got the classic eggs benedict and it was nothing special. i would stick with the sweet breakfast options as the berry pancakes were tasty.,"[(4, 29, 'FOOD'), (171, 192, 'FOOD'), (275, 289, 'FOOD')]"
,"ya got to go to katz's and get a pastrami sandwich when in manhattan.our cutter was awesome we asked for a lean cut and there was virtually no fat left perfect! matzo ball soup was good, although not hot enough.everyone was nice.yum","[(33, 50, 'FOOD'), (161, 176, 'FOOD')]"
,"finally got to try this famous ramen place. we arrived around on a weekday and waited about min.we ordered the char siu pork bun and mega pork ramen. the pork bun was unimpressive to me but the char siu was flavorful and tender. the mayo in the bun was a nice touch.the ramen was delicious and the egg was perfect. the wavy noodles were cooked just right. i did not like how much garlic there was though. there was garlic puree and fried garlic bits. it was too much for me but some people may love that.about halfway through my bowl, the ramen started tasting very heavy and salty. the soup felt almost too thick to drink. the cabbage helped a bit.cash only.","[(31, 36, 'FOOD'), (111, 128, 'FOOD'), (133, 148, 'FOOD'), (143, 148, 'FOOD'), (154, 162, 'FOOD'), (194, 202, 'FOOD'), (270, 275, 'FOOD'), (324, 331, 'FOOD'), (415, 427, 'FOOD'), (432, 449, 'FOOD'), (539, 544, 'FOOD'), (628, 635, 'FOOD')]"
2723,"a must for tourist. get in line, get your ticket, get your pastrami sandwich and enjoy. the place is percent tourist trap but it super fun and tasty food. the sandwich is tasty and the pickles are divine. do not loose that ticket, or it costs to get out the door with out it!","[(59, 76, 'FOOD'), (159, 167, 'FOOD'), (185, 192, 'FOOD')]"
,"having been to toulouse petit for brunch, lunch and late night happy hour, i feel that it is high time to share a review. the excellent reviews brought me here for brunch for the first time years ago, and the consistently delicious food and extensive happy hour offerings keep me coming back even with half-hour waits during prime weekend brunch hours and jam-packed happy hours. this place is nearly always poppin' highlights - duck confit hash and cured pork cheeks confit hash as a lover of breakfast hashes, duck, and anything with the word confit in it, i had to try both of these dishes. they seem to be the exact same - both featuring an innovative combination of cubed potato, parsnip and apple - except for the meats. the pork cheeks are extra tender, but both dishes are solid. - creme caramel french toast soft, fluffy, moist, decadent with caramel sauce and fresh strawberries. my friends the french toast aficionados love this dish. only tilth's golden raisin-sprinkled french toast squares could rival toulouse's, but it is a draw as to whose is better. other dishes - toulouse beignets yummy small triangles of fried donut with plenty of powdered sugar and coffee dipping sauce. i still like cafe du monde's piping-hot beignets best, but these are a pretty good stand-in, especially if you like coffee. - fried chicken gumbo excited to order as i love fried chicken, ok, not amazing. - shrimp and grits my friend enjoyed the sauciness of the shrimp and creaminess of the grits. - yellow beets and haricots vert ok. - buttermilk fried chicken bites pretty good. - beef sliders pretty good. - fried green tomatoes pretty good. this restaurant, with its southern decor, wide assortment of great food, mix of booth and bar seating, and breakfastregularlate night happy hours, knows how to run a thriving business.","[(429, 445, 'FOOD'), (450, 467, 'FOOD'), (456, 460, 'FOOD'), (671, 683, 'FOOD'), (685, 692, 'FOOD'), (697, 702, 'FOOD'), (720, 725, 'FOOD'), (731, 735, 'FOOD'), (790, 816, 'FOOD'), (852, 865, 'FOOD'), (870, 888, 'FOOD'), (876, 888, 'FOOD'), (905, 917, 'FOOD'), (959, 995, 'FOOD'), (983, 995, 'FOOD'), (1126, 1137, 'FOOD'), (1172, 1178, 'FOOD'), (1310, 1316, 'FOOD'), (1320, 1333, 'FOOD'), (1367, 1380, 'FOOD'), (1401, 1407, 'FOOD'), (1457, 1463, 'FOOD'), (1495, 1507, 'FOOD'), (1502, 1507, 'FOOD'), (1532, 1556, 'FOOD'), (1543, 1556, 'FOOD'), (1578, 1590, 'FOOD'), (1606, 1626, 'FOOD')]"
,"k+ reviews what more needs to be said nothing no time to read k+ reviews here are the cliff notes best damn asian style chicken wings pretty damn good jangpong spicy seafood & noodle soup chajangmein black bean sauce noodle shrimp and leeks dumplings parking for this area is as bad an anywhere in sf the avg wait is minutes even for take out some insider stuff from a guy who has been a san tung regular for over a decade to reduce wait, go right before closing the next door sister store shorter wait has same wings and dumplings always write your name right away on the list if you have a name that is hard for an english nd language person make something up like lee or micky mouse , otherwise you may not actually ever hear your name called. when it is close to your spot, watch that board closely.i've seen folks lean up against the dryerase board and names disappear","[(120, 133, 'FOOD'), (160, 173, 'FOOD'), (176, 187, 'FOOD'), (200, 223, 'FOOD'), (224, 250, 'FOOD'), (241, 250, 'FOOD'), (512, 517, 'FOOD'), (522, 531, 'FOOD')]"
2830,"i've never had a lobster roll. it was disappointing. it was cold, bland, teeny portions and gave my entire family the runs. i have nothing else to really say about this place. it was a nice space but the food lacked flavor.","[(17, 29, 'FOOD')]"
2795,great lobster rolls and lobster bisque! the flavor of the lobster is scrumptious and paired with a buttery not too thick roll makes eating this roll an amazing experience! will definitely visit this place again when in the financial district!,"[(6, 19, 'FOOD'), (25, 38, 'FOOD'), (58, 65, 'FOOD')]"
2859,"the mega paitan is the way to go. comes with three varieties of pork so you can try them all! it will put you in a ramen coma. i was a bit apprehensive about trying it because i thought chicken broth would be a bit bland, but i'm glad they used chicken broth because otherwise, i think all that pork would have killed me. the shredded pork, garlic, and other garnishes make this broth extremely heavy in a good way , and i think you could easily split this bowl with someone else.the place itself is a very chic holeinthewall type place. it reminds me of ramen places in japan, but like, american hipsterfied. really cool place to grab dinner. beware of the wait i came early, but there was a bit of a line when i left.there is a place next door that seems to be the same restaurant, but with tonkatsu broth. i might give it a try next time i'm in the area.","[(4, 15, 'FOOD'), (64, 68, 'FOOD'), (115, 120, 'FOOD'), (186, 199, 'FOOD'), (245, 258, 'FOOD'), (295, 299, 'FOOD'), (326, 339, 'FOOD'), (335, 339, 'FOOD'), (341, 347, 'FOOD'), (555, 560, 'FOOD'), (793, 807, 'FOOD')]"
,"been here several times for happy hour and dinner and have always been happy with the food, drinks and service. hhs are awesome here - there is a reason why it is in the top ten. have had beet salad - very yummy, from someone who recoils at the thought of beets cauliflower soup with dungeness crab - very good, even though i'm not even a big fan of cream-based soups manila clams with spanish chorizo - a wonky combination of flavors, but for someone who likes both clams and chorizo, i loved it sinister shrimp and bbq shrimp any of the sliders . but really, people - why come to this place for sliders the cocktails are also incredible and the service very good. we have also never had any problems finding parking, despite the fact that it is lower queen anne. wish this was closer to my 'hood - would love to be able to walk here for a quick bite more often","[(112, 115, 'FOOD'), (188, 198, 'FOOD'), (256, 278, 'FOOD'), (284, 298, 'FOOD'), (368, 401, 'FOOD'), (467, 472, 'FOOD'), (477, 484, 'FOOD'), (497, 512, 'FOOD'), (517, 527, 'FOOD')]"
,"I think the experience at Lowell's can vary significantly depending on whether you go for breakfast/brunch versus lunch or dinner, if you're going at peak tourist summer season versus other times of the year, and whether you're able to grab a window seat. I imagine it's chaos during the summer! The hubby and I have been here during the fall/winter without the overwhelming crowds and really liked their food--it's not cheap for a casual place, but the seafood quality is there. The fish and chips, blackened grilled salmon, dungeness crab cakes, tiger prawns, and cole slaw are all worth their weight in dollars. The seafood is fresh, and being in the market helps with the quality of their ingredients. I will concede, however, that their clam chowder is good but not a slam dunk. We've never been here for breakfast, so can't comment on that menu. First and third floors are self-serve seating, the second floor is traditional dine-in service. We like self service, so never have been to the restaurant section. Employees here are friendly, although we've also never tried snagging a table before ordering. I hear they're veddy, veddy strict on that.","[(484, 498, 'FOOD'), (500, 524, 'FOOD'), (526, 546, 'FOOD'), (548, 560, 'FOOD'), (566, 575, 'FOOD'), (742, 754, 'FOOD')]"
,"i have now been to local for all meals. brunch, lunch, happy hour and dinner and i must say the food is pretty good. their happy hour is the best. you can get fresh taylor shellfish farm oysters for a dollar each during their happy hour. they also have a pretty good burger and great fries to go along with it. the fried gizzard are a must as well, super crispy and full of flavor. for dinner all of their beef preperations are near perfect. the rib eye with marrow butter is excellent. i seriously wish i could have a tub of that marrow butter. ughhhh soo good also if you see the crispy lamb breast you must get it my friend ordered the lamb and it was literally one of the most amazing lamb preperations i've had in awhile. juicy, crispy and super flavorful. i am definitely getting that next time i go. the fried chicken is okay.it is al little dry and i feel like the skin just is not crispy enough. i also feel like the lamb neck poutine has a very strange after taste, also a little too soggy for me. the ambiance is warm and cozy with soft lighting and candles everywhere. service is here is a hit or miss, sometimes when it is really busy it is not as good. i like the concept that everything is locally sourced miles from and around seattle. really great ingredients. good place for any meal.","[(165, 194, 'FOOD'), (315, 328, 'FOOD'), (446, 453, 'FOOD'), (459, 472, 'FOOD'), (531, 544, 'FOOD'), (582, 600, 'FOOD'), (639, 643, 'FOOD'), (689, 693, 'FOOD'), (811, 824, 'FOOD'), (926, 930, 'FOOD'), (936, 943, 'FOOD')]"
,"first of all, lemme state that i do not live in the inner sunset neighborhood with convenience of arrival. it is a mile round trip. so my expectations were high. expectations were further amplified by pbs's check please recommendation as well as another foodie buddy. i must say i liked the caramelized sweetspicy sauce plus the nice surface crunch of their famous dry fried chicken wings. the meat inside though can be a bit tough, compared to the sublime powdered honey butter korean fried chicken at vons in the south bay. overall, the taste of sweetness dominates. and if you also order their dry black bean sauce noodle with seafood, the sweetness of these dishes combined become sorta overwhelming. dry fried chicken sauteed string beans shrimp and leek dumplings . stars dry black bean noodles","[(291, 319, 'FOOD'), (365, 388, 'FOOD'), (466, 499, 'FOOD'), (597, 624, 'FOOD'), (630, 637, 'FOOD'), (705, 722, 'FOOD'), (723, 743, 'FOOD'), (744, 769, 'FOOD'), (778, 800, 'FOOD')]"
301,the four star review is really just for the original dry fried chicken wings since this is the most popular menu item here and you can see that every table got or orders. the restaurant is packed during lunch and dinner hours so there is always a wait time so i usually order foods togo. i do not find other entrees exceptional besides the dry fried wings . some entrees are very good and some are just average dishes so really depends on what i ordered here. i wish the quality could be more consistent across the menu. expect wait time if you come here.,"[(53, 76, 'FOOD'), (340, 355, 'FOOD')]"
,"my girlfriend and i shared lb. of sliced brisket, rack of st. louis ribs, the texas sausage , fries, mac & cheese and cole slaw. all of the meats had great flavor. the mac & cheese was great, as well. the fries were fine. the cole slaw was pretty mediocre but it is just cole slaw so it does not really matter. staff was friendly. came out to about for all the food and drinks which is about par for the course when it comes to quality bbq. they do not serve alcohol, by the way. would definitely come back next time i am in chicago.","[(34, 48, 'FOOD'), (58, 72, 'FOOD'), (78, 91, 'FOOD'), (94, 99, 'FOOD'), (101, 113, 'FOOD'), (118, 127, 'FOOD'), (140, 145, 'FOOD'), (168, 180, 'FOOD'), (205, 210, 'FOOD'), (226, 235, 'FOOD'), (271, 280, 'FOOD'), (436, 439, 'FOOD')]"
290,so freaking good. get the dry fried chicken pieces and the green beans! do not waste any money or space in your stomach on anything else the shrimp and leek dumplings were a waste imo . there will be a line but seriously if you are in sf this is a must so go and thank me later.,"[(26, 50, 'FOOD'), (59, 70, 'FOOD'), (141, 166, 'FOOD')]"
,"lobster roll i thought the serving size was pretty big. i got it delivered and had to eat it in two sittings. it was mainly claw meat. was pretty good, not over the top extraordinary or anything. but the serving size was substantial.clam chowder get this. i like this way more than the lobster roll. salt & vinegar cape cod chips do not get this. way too much vinegar. if you like drinking vinegar straight, you might like this.blueberry sodado not get this. tastes like nothing. it is basically water with a sprinkle of sugar and some bluish color. just get regular water.","[(0, 12, 'FOOD'), (124, 133, 'FOOD'), (233, 245, 'FOOD'), (286, 298, 'FOOD'), (300, 329, 'FOOD'), (428, 442, 'FOOD')]"
,"toulouse petit gets stars for their happy hour food selection alone, in my book they had a ton - maybe -ish.coulda been , i'm horrible at estimating - of small dishes under , which makes it really easy to order a several things to split.the best way to eat at a restaurant.again with the in-my-book comment. we had the spicy lamb sliders and the asparagus with bernaise, and both dishes were addictively awesome. normally, i am one to pay attention to the drink specials as well, but i just ordered my favorite varietal because i was with my mom, and quality not quantity was the name of the game that evening.if you know what i mean. the wine was delicious though we finished-up with an order of the flourless chocolate torte, and all i can say about that is mmmmmmmmmm.bugahhhhhh. kinda wish i did not know about it is awesomeness, being that i live within walking distance of the restaurant. other plusses ambiance awesome. trillions again with the estimating comment of candles all over the restaurant, with sort of a modern-new orleans feel to it.although i've never been to new orleans, so who i am to say sit-down restaurant in lower queen anne that opens before pm. sometimes you do not eat lunch and need quality food in the middle of the afternoon. close to the multitudes of bus lines.and my house. try it out **okay, one minus i wish they had a website. who does not have a website i cannot forward the link to anyone to tell them i need to bring them there.","[(319, 337, 'FOOD'), (346, 369, 'FOOD'), (511, 519, 'FOOD'), (639, 643, 'FOOD'), (701, 726, 'FOOD')]"
2729,"ordered the meat combo, nothing special other then the hype of tourist visit and of course i'm one of them. order the ruben at least the sauerkraut can help the dryness of the meat. drench my meat with mustard to help the meat moisture . also do not loose your ticket if you loose it even if you want to go in for a visit.","[(12, 22, 'FOOD'), (118, 123, 'FOOD'), (137, 147, 'FOOD'), (176, 180, 'FOOD'), (192, 196, 'FOOD'), (222, 226, 'FOOD')]"
294,"i'm not sure if it was because i gave into the massive amount of hype san tungs had, but after finishing my meal i was a bit disappointed in the quality and taste of food they offered at dinner. despite there being people ahead of us when we arrived, the wait went by very fast which was a plus. but take note you only get one chance to be seated once if your name gets called off the wait list, they do not mess around with seating you quickly. so if you do not hear your name called, you are out of luck. we ordered their famous chicken, but we asked for it diced instead of on the bone disappointing. to me the chicken tasted like a less syrupy version of panda express orange chicken , we also ordered a peanut sauce noodle which was amazing, the sauce was rich and well seasoned and the noodles were perfectly cooked in my opinion , we also ordered their green beans which was also decent. it was not as seasoned or oily as other chinese green beans i've eaten, which was a good thing we also got shrimp and leek dumplings the cooks forgot about our dumplings and we did not receive them until after they gave us our bill to leave we had to remind them we ordered it and when we finally did get them, they were tough, over done, and i feel they had too much leek which over powered the rest of the flavor of the dumplings overall san tungs was an okay dining experience. i would not go out of my way to eat here again.","[(531, 538, 'FOOD'), (614, 621, 'FOOD'), (673, 687, 'FOOD'), (680, 687, 'FOOD'), (708, 727, 'FOOD'), (792, 799, 'FOOD'), (860, 871, 'FOOD'), (943, 954, 'FOOD'), (1002, 1027, 'FOOD'), (1055, 1064, 'FOOD'), (1263, 1267, 'FOOD'), (1317, 1326, 'FOOD')]"
,the fact that i have lived in chicago for almost years now and have not been to the purple pig is unfortunate. i went here for for a work dinner with three others. we tried different plates! every single dish was incredible and had such a savory taste to each dish. must get the duck & the crispy pigs ears !,"[(279, 283, 'FOOD'), (290, 306, 'FOOD')]"
306,"i finally got to try this place after a couple of failed attempts. i came here twice before but they were closed. when i arrived, there was about an hour long wait and i was not about to wait that long, so i just ordered for take out. black bean noodles actually tasted like the korean chinese version. of all the places that i've tried in la, it was probably the best that i've tried so far. original dry chicken wings had a good balance of savory and sweet so it was pretty dang delicious. i can see why everyone who comes here orders this. i do not know why it says dry because it is not dry . it is a bit saucy.","[(235, 253, 'FOOD'), (402, 419, 'FOOD')]"
,"the best traditional steak house in seattle. i use that word because of the familiar menu offerings, old-school decor and vibe, and uniformed waitstaff. for steak overall i still prefer bateau, but this is a great spot. i sampled the crab cakes, prime rib , and brussel sprouts. the crab cakes were phenomenal and had different types of crab inside. the prime rib was good, but was surprisingly overshadowed by the roasted root vegetable sides sweet potato, carrot, parsnip that came with it. i was underwhelmed by the brussels after failing to convince my dining companion to get the creamed spinach. the desserts looked delicious, but massive. we saw a slice of the carrot cake that looked like a day's worth of food. may return just to try the cake.","[(21, 26, 'FOOD'), (157, 162, 'FOOD'), (234, 238, 'FOOD'), (234, 244, 'FOOD'), (246, 255, 'FOOD'), (262, 277, 'FOOD'), (283, 287, 'FOOD'), (337, 341, 'FOOD'), (354, 363, 'FOOD'), (415, 437, 'FOOD'), (444, 456, 'FOOD'), (458, 464, 'FOOD'), (466, 473, 'FOOD'), (519, 527, 'FOOD'), (585, 600, 'FOOD'), (668, 674, 'FOOD'), (668, 679, 'FOOD'), (747, 751, 'FOOD')]"
282,"best chinese food in norcal, maybe anywhere. the home made kim chee is the best, then have shrimp and leek dumplings , pork dumplings , or pot stickers. you have never had better. they are home made fillings and noodles. be careful, you have them once and you will have to have them at least once a week! every dish is so flavorful and distinctly different. the yellow curries are awesome. kung pao is amazing. try the black bean homemade noodles or any noodles. chicken wings, garlic chicken, mao pao, dry fried string beans, mu shu, and everything is so special. very crowded for obvious reasons. sometimes the line is down the street. dress warm and bring a beverage to drink while waiting for a table on a friday or saturday night. you will never eat chinese food in san francisco anywhere else again. it is that good!!!! try san tung next door also. that is how good this food is, that they are able to have a second one next door. are you getting it! thank you to the chu family for making eating a heavenly experience! did i mention the sauces are the best in the world! mike mcnair","[(59, 67, 'FOOD'), (91, 116, 'FOOD'), (119, 133, 'FOOD'), (139, 151, 'FOOD'), (212, 219, 'FOOD'), (362, 376, 'FOOD'), (390, 398, 'FOOD'), (419, 446, 'FOOD'), (439, 446, 'FOOD'), (454, 461, 'FOOD'), (463, 476, 'FOOD'), (478, 492, 'FOOD'), (494, 501, 'FOOD'), (503, 525, 'FOOD'), (527, 533, 'FOOD')]"
305,"i've been to san tung a few times and taken it togo countless of other times. the wait is usually pretty long for the weekend. i would say anywhere between an hour to two. if you go about min prior to when they open for dinner you will be able to be seated right away. i saw a large group walk in at opening saying they had reservations but i'm guessing they only take reservations for large parties. recently we ordered the original dry fried chicken , the pork and leek dumplings, the hot and sour soup, the garlic green beans, and the black bean sauce noodles. the original dry fried chicken is great because it has a bit of spice yet a bit of sweetness to it. i would not call it dry exactly though since there is sauce but it is more of a sticky sauce rather than something like buffalo wings . the pork and leek dumplings were not so impressive to me since i felt they were bland and super salty on the inside. i enjoyed the black bean sauce noodles and the garlic green beans. though i did like the hot and sour soup i did notice it tasted very spicy due to a peppery taste it was as if they used a lot of the grey pepper you see in asian restaurants so if you are not into that and a kick of spice then this dish might not be for your. portions are fair for the cost. service can be so so as you would have to wave down the waiters from time to time and maybe multiple times before they catch your attention. i would come back but if the wait is too long i would rather usually just take it to go or door dash it.","[(434, 451, 'FOOD'), (458, 481, 'FOOD'), (487, 504, 'FOOD'), (510, 528, 'FOOD'), (538, 562, 'FOOD'), (577, 594, 'FOOD'), (784, 797, 'FOOD'), (804, 827, 'FOOD'), (931, 955, 'FOOD'), (964, 982, 'FOOD'), (1006, 1023, 'FOOD')]"
