review_id,text,entities
2266,"mecca for pastrami,cornedbeef,hotdogs and pickles. they fedex too!! this is the ultimate in deli meats. if you are a new yorker go. if you live afar, splurge for the fedex. it is worth every penny. get the rye bread loaf too. to die for.","[(10, 18, 'FOOD'), (19, 29, 'FOOD'), (30, 37, 'FOOD'), (42, 49, 'FOOD'), (92, 102, 'FOOD'), (206, 220, 'FOOD')]"
2077,"been here a few times and my most recent was right after they opened after receiving a piss poor grade from the city food inspectors. knowing me, your food are not good unless the kitchen is dirty. i'm serious, the best food in the world is always cooked by the hole in the walls. sorry, that fine dining shit is for snobs with their noses up in the air. if your stomach cannot handle it, cry me a river and work on your immune system game. i'm going to base this review on my most recent visit. came here with a party of for lunch and was seated immediately. waitress was quick and efficient. food came quick as well. i like rabbit but decided to go with something more plain. i opted for the spicy jambalaya, french onion soup and the beignets. the food was just meh.quite regular and nothing special. i found the jambalaya too spicy and i so hated how they just pre-dunk my baguette in the onion soup . next time i will have to tell them to put it on the side. overall, always had a positive experience here. i feel like the food is a hit or miss. i do like to come here at night because the rustic interior reminds me of interview with a vampire featuring brad pitt and tom cruise. toulouse petit was quite the meat market back in the day, if you are into that scene, but who is not i do not frequent queen anne too often so things might be different now.","[(626, 632, 'FOOD'), (694, 709, 'FOOD'), (711, 728, 'FOOD'), (737, 745, 'FOOD'), (816, 825, 'FOOD'), (893, 903, 'FOOD')]"
2448,"the sides shine more than the ramen here! this is one of the few ramen bars in nyc that oozes an authentic japanese basement ramen shop vibe. too bad you have to tip and your do not pay a vending machine.i had the spicy bang bang boiled chicken as a side, i did not have high expectations for it, but it was amazing. it was zesty and the chicken had texture but was not rubbery. the crunchy bean sprouts complemented the chicken well.the chicken paitan based broth did not have a very strong taste to it. there was a lil bit of umami, but not that intense. it was good, but i expected more. there is better chicken paitan broth in nyc. noodles, pork belly and the pulled pork was top notch. the cabbage and garlic were nice touches. overall excellent taste and textures. if you have been here in the past, the mega paitan ramen, the price went up a lil bit and you only get half an egg now.lines can be long, but not as bad as some of the other popular from japan chains in manhattan. they are efficient by taking your orders ahead of time.","[(30, 35, 'FOOD'), (65, 70, 'FOOD'), (125, 130, 'FOOD'), (214, 244, 'FOOD'), (338, 345, 'FOOD'), (383, 403, 'FOOD'), (421, 428, 'FOOD'), (438, 445, 'FOOD'), (438, 452, 'FOOD'), (607, 614, 'FOOD'), (607, 621, 'FOOD'), (636, 643, 'FOOD'), (645, 655, 'FOOD'), (664, 675, 'FOOD'), (695, 702, 'FOOD'), (707, 713, 'FOOD'), (810, 827, 'FOOD'), (822, 827, 'FOOD'), (882, 885, 'FOOD')]"
285,"this was my first time at this restaurant and even on a sunday night for a party of , the wait was almost hrs. i had high expectations for this place so when i visited sf, i knew i had to try it at least once since i was not able to on my prior trip but that was because it was with family and it is rare that the older generation would want to wait this long for food . anyway, i got the shrimp and leek dumplings and it tasted like i could have bought that from the supermarket and made it myself. i also got the black bean sauce noodles which was interesting because i never had it before. then. it was time for the original dry fried chicken wings and wow. those hrs were worth it and my expectations were met! when i come back to visit sf at a future date, i will be sure to return. there will not be any judgment if i only order the dry fried chicken wings, right","[(389, 414, 'FOOD'), (515, 539, 'FOOD'), (628, 651, 'FOOD'), (839, 862, 'FOOD')]"
,"food service . ambiance . food monorail cocktails , beet salad , pork belly , fried chicken with polenta and collard greens , and a side of mac n cheese , would have been perfect with more sauce, apple fritters . freakin' amazing and reasonable portion sizes. service it took a while to get seated even though there was a few tops available as soon as we got there. our server was amazing considering it looked like he was responsible for a huge section and it was packed. very friendly and was on top of his game. ambiance great little hipster space. only thing i would change is add some cushions to the booths as they were a tad bit hard on the bum and risk of slivers highly highly recommend, great experience","[(31, 49, 'FOOD'), (52, 62, 'FOOD'), (65, 69, 'FOOD'), (65, 75, 'FOOD'), (79, 104, 'FOOD'), (109, 123, 'FOOD'), (140, 152, 'FOOD'), (189, 194, 'FOOD'), (196, 210, 'FOOD')]"
,"this is chicago. we are not exactly a bbq town, but when a place has over k reviews and a and half star average you are doing yourself a disservice by not checking it out. the other day i did and i got to say, smoque lived up to the hype. go to texas, and you will wait in a hour long line for ribs that are really close to as tasty as these. the fact that you can get them in under minutes on a sunday is just unreal. not to mention it is actually pretty darn cheap too. full slab with sides was about which was way less than i was expecting. the place is a machine. line moves quick, your food comes out in the blink of an eye, and there is always a staffer there to answer your questions. the only other advice i will offer than has not really been said is to order more than you can eat. cold bbq the next day is actually really underrated.","[(38, 41, 'FOOD'), (294, 298, 'FOOD'), (472, 481, 'FOOD'), (797, 800, 'FOOD')]"
,"had dinner there with my daughter. we both had the french onion soup , she had calimari while i had the prime rib, scalloped potatoes and creamed spinach. to end, she had the carrot cake and i had the layer chocolate cake. what a disappointment. the best part of the dinner was the onion soup . the calimari was slightly greasy, but the biggest problem was how salty the prime rib and scalloped potatoes were. had to use excessive horseradish to counteract. even the end of the meal was disappointing. carror cake was moist, but layer chocolate cake was like eating sand. do not think i have ever tasted a drier desert. all this for over . money not well spent.","[(51, 68, 'FOOD'), (79, 87, 'FOOD'), (104, 113, 'FOOD'), (115, 133, 'FOOD'), (138, 153, 'FOOD'), (175, 186, 'FOOD'), (201, 221, 'FOOD'), (282, 292, 'FOOD'), (299, 307, 'FOOD'), (371, 380, 'FOOD'), (385, 403, 'FOOD'), (431, 442, 'FOOD'), (502, 513, 'FOOD'), (529, 549, 'FOOD')]"
2117,"wow! incredible meal indeed.i came her for a friday lunch with my girlfriend and we were impressed from staff to finish. when you first walk in, you will notice that old school classic ny steakhouse feel that adds to the charm and history of the restaurant.we were immediately sat, it did not look particularly busy on this afternoon. we ordered the day dryaged prime ribeye steak, the heritage pig bolognese and a side of delmonico's potatoes. no drinks for us on particular day but the wine list was extensive and looked impressive. the whole drink menu was actually displayed on an ipad that the waiter hands to you which i thought was very cool.first, the day dryaged prime ribeye steak. just wow. it might be the best steak i've had so far in this city. cooked to a perfect mediumrare, the inside was succulently juicy while the outside had a nice charred crunch to it. you can really taste the dryaged flavor. some restaurants in the city will say their steak is dryaged for x amount of days meanwhile having no dryaged flavor but this steak, you can really tell by the flavor that it is real.next, the heritage pig bolognese . wow again. it is large rigatoni pasta with a bolognese sauce made with pig cheeks. the pasta was made a perfect al dente, just how i like it. i'm a pasta fiend and this one flies straight to the top of my list for pasta dishes in the city. must try.last we tried the delmonico's potatoes. it was sort of a like hot potato salad with more of a consistency of gravy. good but skippable. probably better sides on the menu.overall, amazing flavor experience at delmonico's. the steak and the pasta were to die for and prices are typical of nyc steakhouses. i will be coming back again.","[(350, 380, 'FOOD'), (386, 408, 'FOOD'), (435, 443, 'FOOD'), (660, 690, 'FOOD'), (723, 728, 'FOOD'), (960, 965, 'FOOD'), (1042, 1047, 'FOOD'), (1109, 1131, 'FOOD'), (1157, 1171, 'FOOD'), (1179, 1194, 'FOOD'), (1205, 1215, 'FOOD'), (1221, 1226, 'FOOD'), (1282, 1287, 'FOOD'), (1348, 1353, 'FOOD'), (1413, 1421, 'FOOD'), (1449, 1461, 'FOOD'), (1608, 1613, 'FOOD'), (1622, 1627, 'FOOD')]"
,"my mother and i came here last sunday. the environment and the service were good. my mother and i shared a calamari as our appetizer, the calamari was ok. my mother got a oz. filet mignon with baked potato and i got a salmon with baked potato. the steak and the salmon was so so. not delicious at all. both my mother and i do not like it. we had a new york cheesecake as our dessert, and i like the dessert. it was good. my drink was also good.","[(107, 115, 'FOOD'), (138, 146, 'FOOD'), (175, 187, 'FOOD'), (193, 205, 'FOOD'), (218, 224, 'FOOD'), (230, 242, 'FOOD'), (262, 268, 'FOOD'), (348, 367, 'FOOD')]"
,"with , reviews and a rating i thought my experience at the purple pig would be much more satisfying than it turned out to be. do not get me wrong my meal was good, but it is not worth it to wait for a long time since they do not take reservations. if i lived in chicago and recommending friends on where to eat in a short amount of time, this would not be in the top places to eat... the place is super cramped everywhere. we walked in around pm on a weekday and got seated in ish minutes. they have several large communal tables, seating at the bar, and regular tables. we got seated in front of the kitchen areabar because those were the only seats left. pretty cramped and loud but it was fun to see the chefs making the food. my friend and i ordered cocktails off of the menu. she ordered a basic old fashioned and i ordered a house cocktail cannot remember the name of it but it was vodka based. our drinks were pretty standard in taste, and the presentation was nice but one of the main reasons why i gave the purple pig is that if i am paying for a drink i expect more than half of my glassware to have liquid in it. the large ice cube they put in my cocktail literally made up half of my drink see picture. i was pretty shocked because i have never ordered a cocktail where most of it was just pure ice. the menu changes pretty often and i believe the menu i ordered off of back in june has already changed most of the dishes are tapas style so the waiter recommended we ordered dishes each. we ordered the roasted bone marrow . one of my friends favorite dishes and she said this was just standard but the portion was very large, roasted pineapple pretty interesting flavors, asparagus the best thing i ate here, it tasted like pasta but the whole dish was just tiny cut up asparagus, and the milk braised berkshire shoulder the meat melted in your mouth and the mashed potatoes were delicious.","[(801, 814, 'FOOD'), (888, 893, 'FOOD'), (1515, 1534, 'FOOD'), (1639, 1656, 'FOOD'), (1685, 1694, 'FOOD'), (1737, 1742, 'FOOD'), (1783, 1792, 'FOOD'), (1802, 1833, 'FOOD'), (1872, 1887, 'FOOD')]"
293,"san tung is my go to place for chicken wings! i went yesterday on a friday night for dinner and the wait was surprisingly short. at around pm, there were only people in front of me on the list. this translated to only a minute wait. oftentimes when i would pass by the restaurant, i would notice a crowd so large that it would have had to be at least an hour wait. i've been coming here for the last years with my family before san tung became very well known to the bay area community. still to this day, i order the same things chicken wings, string beans, shrimp and leek dumplings , deluxe noodle. although everything about my meal was delicious, i noticed compared to before, portions are smaller and everything is a lot sweeter especially the string beans and chicken wings. the string beans and the chicken wings used to actually have a mild spiciness level, but you do not get that anymore.","[(31, 44, 'FOOD'), (530, 543, 'FOOD'), (545, 557, 'FOOD'), (559, 584, 'FOOD'), (587, 600, 'FOOD'), (749, 761, 'FOOD'), (766, 779, 'FOOD'), (785, 797, 'FOOD'), (806, 819, 'FOOD')]"
1781,"ok you all, this chowder lives up to the hype. i was recently in seattle for a week and came here twice. and i'm lactose intolerant. the chowder is that good. definitely give the sampler platter a shot so you can try a bunch of chowders - my husband and i shared the scallop chowder far and away my fave, and i do not even like dill, the smoked salmon chowder, seafood bisque, and the market chowder. the accompanying sourdough bread was fresh, warm, and crusty. we also split a dungeness crab roll connecticut style for being on the pricy side, i was a bit underwhelmed could be that i'm a born and bred marylander and am loyal to my blue crabs , or that i wanted this to be more like a lobster roll .","[(17, 24, 'FOOD'), (137, 144, 'FOOD'), (267, 282, 'FOOD'), (275, 282, 'FOOD'), (338, 359, 'FOOD'), (352, 359, 'FOOD'), (361, 375, 'FOOD'), (392, 399, 'FOOD'), (418, 433, 'FOOD'), (479, 498, 'FOOD'), (688, 700, 'FOOD')]"
2629,very disappointing.the house delmonico was the fattiest steak i've ever been served in a high end steak house. service was outstanding though as should be expected at these prices. risotto was well prepared shrimp was excellent. all in all a good bucket list check off but will not be back,"[(56, 61, 'FOOD'), (98, 103, 'FOOD'), (181, 188, 'FOOD'), (207, 213, 'FOOD')]"
,"my girlfriend and i came here right at opening pm and sat at the bar since we did not have a reservation. we ordered the pig face and lamb ribs, which were both good, but that was where the good things about this restaurant ended. this was the absolute worst restaurant experience either of us have ever had, the bartenders were beyond rude and condescending. as soon as we told the bartender we would not be ordering any drinks, she glared at us and proceeded to ignore us the rest of the time we were there while being extremely friendly to the people next to us who were spending hundreds. someone needs to teach the servers that they need to treat everyone with respect, not just the rich customers. would never come back or recommend to anyone.","[(121, 129, 'FOOD'), (134, 143, 'FOOD')]"
,"we ate there last night. this is the first time i've ever written a yelp review. i just had to say something about our dining experience at the metropolitan grill. firstly the staff were efficient, friendly and informed. no issues there. what i do take issue with is the lack of quality of their food. we ordered filets, pepper steak and a large lobster tail. all top priced items. we also had calamari , asparagus and what was supposed to be roasted cauliflower. none of it measured up. steaks cooked incorrectly, limp asparagus and chewy dry calamari . i do mean chewy. this is a popular seattle establishment. one that is been here for a long time. over the past years, i've probably gone to - business dinners there. i think that may be the point. business dinners paid for with generous expense accounts do not get the scrutiny. however special occasion dinners paid for by an individual, albeit a retired ceo, bear a closer look. ok i get it. i should let it go. i can afford it, right well i suppose you are right. i can. but damn sam i hate to be top dollar and get handed sub par fare. i will not be going back. i will just remember the good old days when an steak meant something.","[(313, 319, 'FOOD'), (321, 333, 'FOOD'), (340, 358, 'FOOD'), (394, 402, 'FOOD'), (405, 414, 'FOOD'), (443, 462, 'FOOD'), (488, 494, 'FOOD'), (520, 529, 'FOOD'), (544, 552, 'FOOD')]"
,"three michelin stars. in the world world's best, . we made our reservation months in advance for the gallery. after spending a small fortune ahead of time, we were more than intrigued to see if alinea would live up to the hype andor compare to other michelin restaurants of this caliber. pros newly renovated interior, still intimate yet simple. elements of surpriseshow. staff brad, miguel, everyone was amazing. attentive to allergies. experiencing the alinea kitchen very smart idea. drink pairings not mandatory for the whole table if one person opts for it. the iconic taffy helium balloon and grand finale dessert were everything we had anticipated, and more. seriously mindblown. the number of desserts in the tasting menuperfect for me as it is my favorite course. thai inspired dish outstanding. my one point of contention we had the pm seating. i personally felt as though the pace of the courses went very fast. by the end of the more savory courses, i felt overwhelmed as the food was quite decadent ie. black truffle mousse, caviar, lobster, more black truffle sandwich, wagyu beef, bone marrow, mushroom. i am surprised to read that anyone would leave alinea hungry because this to me seems impossible. the staff, however, were very gracious and we stayed for as long as we wanted.","[(575, 594, 'FOOD'), (612, 619, 'FOOD'), (701, 709, 'FOOD'), (1016, 1036, 'FOOD'), (1038, 1044, 'FOOD'), (1046, 1053, 'FOOD'), (1060, 1082, 'FOOD'), (1084, 1094, 'FOOD'), (1096, 1107, 'FOOD'), (1109, 1117, 'FOOD')]"
,decided to stop by here for a super early dinner on saturday right after they opened. it was a good idea to come early since we were able to grab seats at the bar non bar seatings are reservation only!. the place was also packed when we were leaving. the service here was amazing throughout the meal. the interior of the place was super classy and bright. goat carpaccio super well made dish. i love how there were salmon roe on top of the carpaccio that gave it a nice savory touch with the fish oil. great appetizer to start. braised beef tongue extremely tender meat and i only wish there was more! the flavor also the salsa verde went really well with the greens and meat. calamari bruschetta the grilled calamari was so fresh and delicious. the bruschetta was a bit too heavy for my taste and one of the bread was kind of stale. overall a great meal. apparently you can do half orders for some dishes? but i would definitely double check.,"[(356, 370, 'FOOD'), (415, 425, 'FOOD'), (440, 449, 'FOOD'), (492, 500, 'FOOD'), (528, 547, 'FOOD'), (565, 569, 'FOOD'), (622, 633, 'FOOD'), (660, 666, 'FOOD'), (671, 675, 'FOOD'), (677, 696, 'FOOD'), (701, 717, 'FOOD'), (750, 760, 'FOOD'), (809, 814, 'FOOD')]"
2198,"mad dog has a good location in the financial district among the cobblestone street. the appetizer i had was the chicken chimichangas which tasted great. unfortunately they only served and it was small. entree i had was the chicken tacos which tasted really well. they served four but they are small. the restaurant has a nice environment to talk to friends not too loud, screens for looking at sports highlights. the server was friendly and food did not take long to arrive.","[(112, 132, 'FOOD'), (223, 236, 'FOOD')]"
299,"i'm more of a buffalo wild wings kinda gal, but i have to admit that the original dry fried chicken wings from here have me feelin' some type of way. these wings are the numero uno reason to visit. if you are visiting to try other menu items from here, then get the f ck out. just kiddingother somewhat noteworthy things to order include the shrimp and leek dumplings and the dried sauteed green beans. no frills good food. anyway, back to the wings. they come out piping hot, savory n' sweet, and crispy. get ready for some major finger lickin' action. yum.","[(14, 32, 'FOOD'), (82, 105, 'FOOD'), (156, 161, 'FOOD'), (342, 367, 'FOOD'), (376, 401, 'FOOD'), (444, 449, 'FOOD')]"
2829,"i was so excited to try luke's lobster. i've heard only great things lobster is fresh, great selection, cool environment.when i walked in, i scanned the menu written on a black board on the wall . seemed like a good varietyrolls, grilled cheese, yum. after ordering, my food was ready in less than a minute i ordered the lobster roll combocomes with chips or slaw and a drink . the roll looked pretty good. the bread was nice and toasted, lobster was cold and had some type of seasoning sprinkled on top.first bite was okay lobster was a little bland. when i started to go in for my second bite, i noticed there were some weird milkycolored chunks of something.at first i thought it was a vegetable but after taking a bite of one it had a consistence like a super overcooked vegetable. i shrugged it off and picked those pieces out of the roll. next two bites had big pieces of lobster she will.not so fun to have to pick those out of my mouth. another bite had sand! totally turned me off and i could not continue eating the roll. i was so bummed because i heard such great things, and saw great reviews here on yelp.the slaw was okay.had a nice vinegary flavor. they have a great selection of sodai tried the blueberry honey lemonade, which i really enjoyed.i am not the type to be super picky about casual food, but the sand, she will, and mysterious milky white chunks were just not acceptable.overall i would not recommend this location, but am going to try another luke's lobster.","[(31, 38, 'FOOD'), (69, 76, 'FOOD'), (223, 228, 'FOOD'), (230, 244, 'FOOD'), (321, 328, 'FOOD'), (321, 339, 'FOOD'), (350, 355, 'FOOD'), (359, 363, 'FOOD'), (382, 386, 'FOOD'), (439, 446, 'FOOD'), (524, 531, 'FOOD'), (839, 843, 'FOOD'), (878, 885, 'FOOD'), (1026, 1030, 'FOOD'), (1122, 1126, 'FOOD'), (1195, 1199, 'FOOD'), (1211, 1235, 'FOOD'), (1478, 1485, 'FOOD')]"
,"after a night of wedding celebrating in the middle of nowhere beautiful lake and woods, much wilderness hubs and i grabbed lunch here before heading home to ca, we did not make a reservation so after ~mins wait we seated ourselves at the bar. the bartender was very friendly and took our order right away. we got scramble of the day with country potatoes and biscuit and chicken fried steak with mushroom, gravy, eggs and biscuit. both was really really good. the biscuitwhich came with whipped butter tasted homemade and not overly saltygreasy. my hubby's chicken fried steak was super delicious, the mushroom flavor was on point. my scramble was perfectly done, i only wish there were a little bit more, even though i felt stuffed after finishing everything. my side of country potato was very heavily spiced with some heat not my fave, but it complimented the light, fluffy scramble. at we were a bit comprehensive since we have been to a few of those places. how should i put it, hipster fusion-holier than thou-super organic-bougie.they are making 'farm to table' sound like a fad. where they serve over priced food that taste mediocre. local somehow got it right. it is too bad we live so far away otherwise this would be an awesome brunch, or lunch, or dinner spot.","[(313, 321, 'FOOD'), (338, 352, 'FOOD'), (359, 366, 'FOOD'), (371, 404, 'FOOD'), (406, 411, 'FOOD'), (413, 417, 'FOOD'), (422, 429, 'FOOD'), (464, 471, 'FOOD'), (487, 501, 'FOOD'), (557, 576, 'FOOD'), (571, 576, 'FOOD'), (602, 610, 'FOOD'), (635, 643, 'FOOD'), (772, 786, 'FOOD'), (877, 885, 'FOOD')]"
